{
  "version": "plf-1",
  "id": "3f1c8a40-8e1d-4d2f-9c5e-1a2b3c4d5e6f",
  "session_id": "a91d6f3c-7b22-49ee-bc3d-4f5a6b7c8d9e",
  "timestamp": "2026-04-29T14:32:08.142Z",
  "author": {
    "email": "jane@example.com",
    "name": "Jane Doe",
    "id": "B5E2C19F8A3D4710"
  },
  "tool": {
    "name": "claude-code",
    "version": "2.4.0"
  },
  "model": {
    "provider": "anthropic",
    "name": "claude-opus-4-7",
    "version": "20260301"
  },
  "prompt": "refactor server/auth/middleware.ts to use the new TokenSession API instead of the cookie-based session, and update the related tests",
  "git": {
    "branch": "feat/auth-rewrite",
    "head_commit": "a1b2c3d4e5f6",
    "dirty": true
  },
  "cwd": "../server",
  "parent": {
    "prompt_id": "1c2b3a4d-5e6f-4a8b-9c0d-1e2f3a4b5c6d"
  },
  "outcome": {
    "summary": "Replaced cookie-based middleware with TokenSession API across server/auth/. Updated 3 call sites in server/routes/, added 4 new test cases, all tests passing.",
    "files_touched": [
      "server/auth/middleware.ts",
      "server/auth/middleware.test.ts",
      "server/routes/login.ts",
      "server/routes/logout.ts",
      "server/routes/me.ts"
    ],
    "commits": ["e4f5a6b7c8d9"],
    "status": "completed"
  },
  "enrichments": {
    "tokens": {
      "input": 12400,
      "output": 2810,
      "cache_read": 8900,
      "cache_write": 1500
    },
    "cost_usd": 0.18,
    "duration_ms": 48210
  }
}
