{
  "version": "plf-1",
  "id": "9b7d2a4c-1e3f-4a5b-8c7d-6e5f4a3b2c1d",
  "session_id": "a91d6f3c-7b22-49ee-bc3d-4f5a6b7c8d9e",
  "timestamp": "2026-04-29T14:36:15.003Z",
  "author": {
    "email": "jane@example.com",
    "name": "Jane Doe"
  },
  "tool": {
    "name": "claude-code",
    "version": "2.4.0"
  },
  "model": {
    "provider": "anthropic",
    "name": "claude-opus-4-7"
  },
  "excluded": {
    "reason": "matched .promptcellarignore",
    "pattern_id": "secrets"
  }
}
